jobTitle,company,applicationDate,location,remoteBool,companyUrl,sourceUrl,applicationUrl,listedComp,estimatedComp,requestedComp,jobDescription,submissionTime
MMIS Specialist,Deloitte,3/3/2024,"Madison, WI",on,https://www.deloitte.com/global/en/Industries/government-public/about.html,,https://jobsus.deloitte.com/madison-wi/mmis-specialist/DC6E83B01B6549ECA24F705B305F6282/job/,,,,"
Deloitte MMIS Specialist in Madison, Wisconsin

State Medicaid Data Warehouse Analytics SME

Are you a Medicaid Management Information System (MMIS) subject matter expert with technical/functional State Medicaid Data Warehouse Analytics experience? Do you want to help us transform the Medicaid market as it embraces modularization and we help our clients create a new future for Medicaid technology.

Work you'll do

Work on implementing MMIS or Medicaid Data Warehouse for State Medicaid Agencies

Provide system level expertise across multiple computing platforms and technologies and work to influence direction around information management at the Enterprise Level

Work with program managers, state directors and other key stakeholders, build sustainable relationships with key stakeholders responsible for information and performance management in client's organization

Organize knowledge transfer to clients

Develop and manage vendor relationships

Present in workshops for client education

Manage team s on a data warehousing engagement

The team

Our Health Technology team implements repeatable solutions to solve our government clients' most critical health technology related issues. We advise on, design, implement and deploy solutions focused on government health agencies ""heart of the business"" issues including claims management, electronic health records, health information exchanges, health analytics and health case management.

Our clients seek a fresh perspective on how to leverage reusable, interoperable and flexible solutions that will enable them to reduce costs, improve health outcomes and respond to public health crises. Professionals will use their deep health, government and technology consulting experience to strategically help solve our client's technology challenges.

Qualifications Required:

3+ years of experience within a Consulting or Health Technology environment

State MMIS experience

Data Warehouse experience

Bachelor's Degree from an accredited College or University

Must be legally authorized to work in the United States without the need for employer sponsorship, now or at any time in the future

Desired:

Experience within Medicaid Management Information systems (MMIS), Medicaid or Commercial Health Care claims, Provider Management and/or Eligibility data

Experience implementing a data warehouse for State Medicaid Agency

Experience with one of more of the following: SQL/PLSQL, ETL, Cognos, R, Python, Tableau, QlikView, Power BI, Business Objects

Experience in designing, analyzing, supporting and developing data warehouse objects, data quality processes, fact and dimension tables, logical and physical database design, data modeling, reporting process metadata and ETL processes.

Experience working in Cloud based environment (AWS or Azure)

Healthcare Data Analytics

Oral and written communication skills, including presentation skills (MS Visio, MS PowerPoint

Ability to travel up to 50%The wage range for this role takes into account the wide range of factors that are considered in making compensation decisions including but not limited to skill sets; experience and training; licensure and certifications; and other business and organizational needs. The disclosed range estimate has not been adjusted for the applicable geographic differential associated with the location at which the position may be filled. At Deloitte, it is not typical for an individual to be hired at or near the top of the range for their role and compensation decisions are dependent on the facts and circumstances of each case. A reasonable estimate of the current range is $97,875 to $163,125.

You may also be eligible to participate in a discretionary annual incentive program, subject to the rules governing the program, whereby an award, if any, depends on various factors, including, without limitation, individual and organizational performance.

All qualified applicants will receive consideration for employment without regard to race, color, religion, sex, sexual orientation, gender identity, national origin, age, disability or protected veteran status, or any other legally protected basis, in accordance with applicable law.",17:50:1709855423
